######################################,,,,,,,,,M,,EMO/NEU,POS/NEG,EMOTION,VALENCE,0-None 1- side-effect 2-Therapy 3-Sympathy-Empathy
But I'm still very short of breath.,,,,,,,,,,1-Jan,1,0,2000-10,-1,1
I walk 2 miles 5 x week and do 15 minutes of mild exercises from a workout video (arms stomach squats etc) 3 days x week.,,,,,,,,,,0,0,0,0,0,2
I walk slowly and still breathe hard and the same during the exercises.,,,,,,,,,,0,1,0,000-100,0,1
I also have emphesyma.,,,,,,,,,,0,0,0,0,0,0
Does anyone know if I may have reached my full breathing recovery?,,,,,,,,,,0,0,0,0,0,0
It was improving very slowly for months since the surgery and now 9 months later I feel like it's staying the same for the last month or so.,,,,,,,,,,1-Jan,1,0,00-10-10,-1,1
I don't like to walk with friends because talking makes me more breathless.,,,,,,,,,,1-Jan,1,0,2000-10,-1,1
So I walk alone slowly to concentrate on keeping my breathing in control (slowing my pace when I feel my breathlessness increasing too much) so that I don't have to stop during the 2 miles.,,,,,,,,,,0,1,0,2000-10,-1,1
Also very short of breath when I go upstairs.  Is this normal?,,,,,,,,,,0,1,0,1/1/2000,-1,1
#############################################,,,,,,,,,F,#,#,#,#,#,#
Hi all my husband is getting a sore throat from radiation treatments and his doctor says if it gets to the point where he is having trouble eating they will need to stop the radiation for awhile.,,,,,,,,,,0,1,0,2000-10,-1,1
Just wondering if you all have found anything that helps with the sore throat so he can get the radiation as long as possible.,,,,,,,,,,0,0,0,0,1,2
He is half way through his 3rd week with 4 weeks to go.,,,,,,,,,,0,0,0,0,0,0
#############################################,,,,,,,,,F,#,#,#,#,#,#
"Ask his doctor for a prescription for ""magic mouthwash"" he will know what it is.",,,,,,,,,,0,1,1,100,1,2
This may help enough for him to be able to eat.,,,,,,,,,,11,1,1,100,1,2
I did not experience anything but the slightest sore throat from my radiation but as soon as I said my throat felt a little sore he gave me the prescription.,,,,,,,,,,0,1,1,100,1,2
I took it a couple of times and it really numbed my throat.,,,,,,,,,,0,1,1,100,1,2
I hope this helps. Best wishes to both your hubby and you!,,,,,,,,,,11,1,1,100,1,3
#############################################,,,,,,,,,F,#,#,#,#,#,#
I had 35 days of radiation for NSCLC and had the very sore throat after about the 20th session it is from the burnt esophagus.,,,,,,,,,,1-Jan,1,1,100,1,1
My DR. described as a bad sun burn to the throat this was by far my worse side effect from my cancer treatments.,,,,,,,,,,0,1,0,0000-20,-2,1
The magic mouth wash does help. Water was like drinking acidfound spring water was best (no floride) ate lots of mash potatoes puddings ice-cream and scrambled eggs worked best for me.,,,,,,,,,,11,1,1,100,1,2
Stay away from acidic type foods.,,,,,,,,,,0,1,1,100,1,2
I continued with the rads to the end of treatments.,,,,,,,,,,0,1,1,100,1,2
It will get better.,,,,,,,,,,11,1,1,100,1,3
Best wishes to your husband and you....,,,,,,,,,,11,1,1,100,1,3
Not easy but you can beat this..... Dan,,,,,,,,,,11,1,1,100,1,3
#############################################,,,,,,,,,F,#,#,#,#,#,#
I can't get it down without gagging then vomit.,,,,,,,,,,0,1,0,2000-10,-1,1
If I get any down it only lasts an hour or 2.,,,,,,,,,,0,1,0,2000-10,-1,1
But I will say my doctor just gave me antibiotics for a yeast I infection in my throat to my stomach.,,,,,,,,,,0,0,0,0,0,2
Day 2 not much relief yet.,,,,,,,,,,1-Jan,1,0,-30,-1,2
#############################################,,,,,,,,,F,#,#,#,#,#,#
I've been there (last summer) but was lucky enough to experience the problem only for about the last 1.5-2 weeks of radiation.,,,,,,,,,,11,1,1,100,1,1
It was pretty uncomfortable while it lasted (also my most noticeable side effect of 7 weeks of concurrent radiation and chemo).,,,,,,,,,,1-Jan,1,0,0000-20,-2,2
What worked fairly well for me:,,,,,,,,,,11,1,1,200,2,2
#############################################,,,,,,,,,M,#,#,#,#,#,#
Yes get the magic mouthwash.,,,,,,,,,,0,1,1,100,1,2
I think it's Maalox with lidocaine or some such mix. It will help.,,,,,,,,,,11,1,1,100,1,2
#############################################,,,,,,,,,M,#,#,#,#,#,#
They will advise taking it with a straw which you need to do in order to deaden your throat and not your mouth.,,,,,,,,,,0,1,1,100,1,2
#############################################,,,,,,,,,M,#,#,#,#,#,#
I discovered pretty quickly to cut the end of the straw that goes into the liquid as short as possible.,,,,,,,,,,0,1,1,100,1,2
You want to be delivering the good stuff to your esophagus ASAP and sucking through the full length of the straw takes too much time and effort.,,,,,,,,,,0,1,1,100,1,2
#############################################,,,,,,,,,M,#,#,#,#,#,#
"Eat quickly after ingesting the ""magic"" because the effect will wear off.",,,,,,,,,,11,1,1,100,1,1
#############################################,,,,,,,,,M,#,#,#,#,#,#
Follow the food recommendations as closely as possible (everything at room temperature no acid no abrasives);,,,,,,,,,,0,1,1,100,1,2
it will get to the point where even lukewarm water is painful.,,,,,,,,,,1-Jan,1,0,0000-20,-2,1
My docs advised against things like mashed potatos; they stick in one place and are actually fairly abrasive.,,,,,,,,,,1-Jan,1,1,100,1,1
I found that to be true.,,,,,,,,,,0,1,1,100,1,2
#############################################,,,,,,,,,M,#,#,#,#,#,#
My salvation for the last week was well-done spaghetti with a lot of butter with the occasional serving of thoroughly boiled hot dogs diced up pretty small.,,,,,,,,,,0,1,1,200,2,2
Strangely I also had fairly good luck with corn flakes thoroughly soaked in milk.,,,,,,,,,,11,1,1,200,2,2
You will want to experiment with smoothies and pudding of various kinds.,,,,,,,,,,0,1,1,100,1,2
#############################################,,,,,,,,,M,#,#,#,#,#,#
You'll have to tough it out to a degree but get into a routine and stick with it.,,,,,,,,,,0,1,1,100,1,2
He'll start to feel like a million bucks a couple weeks after the treatment is done.,,,,,,,,,,11,1,1,100,1,2
#############################################,,,,,,,,,F,#,#,#,#,#,#
I am still having a sore throat 5 months after radiation for vocal chord cancer.,,,,,,,,,,0,1,0,0000-20,-2,3
ENT prescribed antibiotic for 3 weeks saying it could be inflamation due to radiation.,,,,,,,,,,0,1,1,100,1,2
Still sore throat next step is CAT scan.,,,,,,,,,,0,1,0,2000-10,-1,2
Has anyone else had this problem? Also I will get a tickle in my throat and the have a bad coughing spell then usually cough up a clear salty mucous.,,,,,,,,,,1-Jan,0,0,0,0,1
Could this be related to radiation?,,,,,,,,,,0,0,0,0,0,0
#############################################,,,,,,,,,M,#,#,#,#,#,#
I see you issue's are probobly long gone.,,,,,,,,,,11,1,0,2000-10,0,3
Maybe you can give me some help.,,,,,,,,,,0,0,0,0,0,0
I went through 7 weeks of Chemo and radiationwhich was complete 4 months ago.,,,,,,,,,,0,0,0,0,0,2
I had cancer on one of my vocal cordsthey say it's gone now.,,,,,,,,,,0,0,0,0,0,0
My problem is my throat is still very sore and talking is a real big issue.,,,,,,,,,,1-Jan,1,0,0000-20,-2,1
I just had a PET scan before Thanksgiving and the ENT surgeon said the cancer is gone but the radiation caused a great deal of swelling which doesn't seem to be getting any better.,,,,,,,,,,1-Jan,1,0,0000-20,-2,1
I can deal with the sore throat but my vocal issue's are really frustrating.,,,,,,,,,,1-Jan,1,0,-2020,-2,0
They have tried several antibiotics and now Prednisone.,,,,,,,,,,0,0,0,0,0,2
I go back to the ENT people this Thursday but really I'm kinda losing faith in these Duke Drs for after affects.,,,,,,,,,,1-Jan,1,0,00-20-20,-2,0
#############################################,,,,,,,,,M,#,#,#,#,#,#
I was dx'd in 2009 with tumor in the eppligotis...7 weeks of radiation..refused chemo..,,,,,,,,,,0,0,0,0,0,2
I had a voice until radiation and it damaged one of my vocal cords so I have been left with just a whisper mst of the time once in awhile my voice works but it does not sound like me.,,,,,,,,,,0,1,0,2000-10,-1,1
and if I use it to long it irritates m throat and I cough.,,,,,,,,,,1-Jan,1,0,2000-10,-1,1
It was frustrating for a long time but after this long I am just glad to be a thriver.,,,,,,,,,,1-Jan,1,1,100,1,3
It makes things hard at times...phone calls...jobs...lol I asked about options but there is that chance that messing with my throat could wake the sleeping c and I have absolutly no interest in that.,,,,,,,,,,1-Jan,1,0,2000-10,-1,1
#############################################,,,,,,,,,M,#,#,#,#,#,#
I used to have that happen but it only lasted about the first year after therapy.,,,,,,,,,,0,1,0,2000-10,-1,1
"It got less and less through the year.y onc prescribed ""Miracle Mouthwash"" that I used daily it was awesome and I always used it prior to eating it made life so much better and I had a standing prescription for it for the first year after therapy.",,,,,,,,,,11,1,1,200,2,2
#############################################,,,,,,,,,M,#,#,#,#,#,#
Find out who manufactured equipment being used.,,,,,,,,,,0,1,1,100,1,3
Varian was sued for millions for over radiating patients as equipment was not working properly.,,,,,,,,,,0,1,0,2000-10,-1,2
Also make sure Dr is not over radiating patient.,,,,,,,,,,1-Jan,1,1,100,1,2
#############################################,,,,,,,,,M,#,#,#,#,#,#
Try adding honey to your daily routine.,,,,,,,,,,0,1,1,100,1,2
It is an anti oxidant that has been used to treat burns for millennium.,,,,,,,,,,0,1,1,100,1,2
You do not need to buy the 'medical grade' Manuka honey.,,,,,,,,,,0,1,1,100,1,2
Any honey is good but the darker the honey the more antioxidants healing and soothing power.,,,,,,,,,,0,1,1,100,1,2
Raw honey may contain botulins so use a processed honey.,,,,,,,,,,0,1,1,100,1,2
Have a heaping spoonful 15-30 minutes before radiation and again about15 minutes after.,,,,,,,,,,0,1,1,100,1,2
#############################################,,,,,,,,,M,#,#,#,#,#,#
I also found eating scrambled eggs easy.,,,,,,,,,,0,1,1,100,1,3
Try soups with cream. Cream of chicken cream of mushroom etc.  they help add weight.,,,,,,,,,,11,1,1,100,1,3
Make milk shakes with Boost or Ensure.,,,,,,,,,,11,1,1,100,1,2
My favorite daily treat during chemo and radiation was a  hot fudge sundae sometimes I added a banana.,,,,,,,,,,11,1,1,100,1,3
#############################################,,,,,,,,,F,#,#,#,#,#,#
If you are considering Oasis of Hope hospital my advice to you is too go at your own risk.,,,,,,,,,,1-Jan,1,0,2000-10,-1,2
#############################################,,,,,,,,,F,#,#,#,#,#,#
My brother who was diagnosed with stage 4 lung cancer went there with high hopes and good spirits.,,,,,,,,,,11,1,1,200,2,2
#############################################,,,,,,,,,F,#,#,#,#,#,#
While there he encountered a language barrier problem and a delayed response for pain medication which was finally administered after he paid an extra charge.,,,,,,,,,,1-Jan,1,0,0000-20,-2,2
#############################################,,,,,,,,,F,#,#,#,#,#,#
He arrived home with no particular instructions as to his care- We admitted him because of his condition the next day to our hospital in California and as I've stated before he died 4 days later.,,,,,,,,,,0,1,0,0000-20,-2,0
#############################################,,,,,,,,,F,#,#,#,#,#,#
After a certified letter 3 Emails and numerous phone calls to Oasis I have received no response at all to my questions not even a condolence card or letter.,,,,,,,,,,1-Jan,1,0,-200000,-2,2
#############################################,,,,,,,,,F,#,#,#,#,#,#
Please note that the answer to my brother?s original inquires about Oasis were answered within 24 hours with a phone call from the staff.,,,,,,,,,,0,1,0,-20002,-2,2
#############################################,,,,,,,,,F,#,#,#,#,#,#
Ultimately it seems that money takes precedence over the care and responsibility due the patients at Oasis.,,,,,,,,,,0,1,0,0000-20,-2,2
#############################################,,,,,,,,,F,#,#,#,#,#,#
I feel that Dr. Contreras and his staff have acted in a very unprofessional manner and lack the common courtesy which should be expected from a Doctor and his staff!,,,,,,,,,,1-Jan,1,0,-2020,-2,2
#############################################,,,,,,,,,F,#,#,#,#,#,#
The following certified letter was sent to Dr. Contreras following the death of my brother three days after returning from Oasis Hospital.,,,,,,,,,,0,1,0,-100000,-1,0
#############################################,,,,,,,,,F,#,#,#,#,#,#
In the following months many phone calls to the doctor?s assistants took place.,,,,,,,,,,0,0,0,0,0,0
After being assured that his case was being evaluated we still have received no response from either him or my brother?s doctors.,,,,,,,,,F,1-Jan,1,0,-20001,-2,2
#############################################,,,,,,,,,,#,#,#,#,#,#
Please read this letter before making any decision to seek treatment at Oasis of Hope Hospital.,,,,,,,,,,0,1,1,100,1,3
#############################################,,,,,,,,,F,#,#,#,#,#,#
The same thing happened to my Husband he got to where he couldnt swallow they took his blood  when we got back to out regular hospital he had to have a blood transfusion we were suppose to make 3 trips and he would be cured from lung cancer we only made 2 we payed 50 thousand dollars this is just not fair my husband went over therein good spirits he started droping wait like you wouldnt believe well he couldnt eat that crap castus drinking alvacado juicecarrot juice it made him sick and 70 pills a day he was taking.,,,,,,,,,,1-Jan,1,0,2000-10,-1,1
He really believed in them he died within 2 months doctors over there 20 years old havent even had time to go to college there is no way they are old enough to be surgeons they said dr contreas has several homes and maids because he has made so much moneycome on he is the doctor there the owner of the hospital and the preacher st the hospital smart mani dont see how he can live with his self doing this to people the people that were there in 2007 walking around asking you what kind of cancer you have they are still there today telling you they got cured from cancer there  Wonder how much they are getting paid to do that CRAZY IS ALL CAN SAY I COULD OF HAD MY HUSBAND PROBABLY ANOTHER YEAR ARE MORE IF WE WOULDNT HAVE WENT THERE AND HE WAS SO SCARED HE DIDNT EVEN NO THEY WERE A SCAM THAT IS WHAT REALLY MAKES ME SICK HE WASNT BUT 62 YEARS OLD ITS A SHAME WE CANT DO NOTHING ABOUT THIS BUT THATS THE WAY IT GOS HE WILL GET HIS ONE OF THESE DAYS 3 PEOPLE DIED WHILE I WAS THERE JUST THAT I HAD BEEN TALKING TO NO TELLING HOW MANY REALLY DIED WHILE I WAS THERE THANKS FOR LISTENING HOPE YOU TAKE TIME TO READ IT AND THINK TWICE BEFORE YOU GO THERE.,,,,,,,,,,1-Jan,1,0,-200000,-2,2
#############################################,,,,,,,,,F,#,#,#,#,#,#
I have small cell lung cancer.,,,,,,,,,,0,1,0,2000-10,-1,0
It is making its comeback after the initial chemo.  This was expected.,,,,,,,,,,0,1,0,2000-10,-1,1
I am looking at it as a trench warfare.,,,,,,,,,,0,1,0,2000-10,-1,3
I do not look at how bad things are.  I just keep fighting.,,,,,,,,,,11,1,1,100,1,3
In the meantime I live life to its fullest.,,,,,,,,,,11,1,1,200,2,0
I find meditation yoga and personal fitness very important.,,,,,,,,,,0,1,1,200,2,2
I also enjoy healthy adn delicious meals.,,,,,,,,,,11,1,1,200,2,0
I have a drink once in a while but rarely.,,,,,,,,,,0,0,0,0,0,2
I am probably going to use medical cannabis during this phase.,,,,,,,,,,0,0,0,0,0,3
#############################################,,,,,,,,,M,#,#,#,#,#,#
My wife is absolutely useless at this point.,,,,,,,,,,1-Jan,1,0,2000-10,-1,0
You can't tell her anything.,,,,,,,,,,0,1,0,-1010,-1,1
She behaves as if she is the one with cancer.,,,,,,,,,,0,1,0,-2020,-2,1
She is spoiled rotten and it is my fault.,,,,,,,,,,1-Jan,1,0,-200000,-2,0
I never thought she would become so wrapped up in herself.,,,,,,,,,,0,1,0,00000-2,-2,1
I am done with her and it will be her choice if she wants to hang around or not.,,,,,,,,,,0,1,0,0000-20,-2,0
But she can't continue to ruin my days.,,,,,,,,,,1-Jan,1,0,-200000,-2,0
I have her set up financially and can walk at anytime if that's what she wants.,,,,,,,,,,0,1,0,0000-20,-2,0
It doesn't matter to me.,,,,,,,,,,0,1,0,0000-20,-2,0
I make new friends all the time.,,,,,,,,,,0,1,1,100,1,0
#############################################,,,,,,,,,M,#,#,#,#,#,#
I wish there was more to talk about except there isn't my friend.,,,,,,,,,,0,1,0,2000-10,-1,3
I will be here anytime you want to talk.,,,,,,,,,,0,1,1,100,1,3
I am new here.  I did not join earlier because it was not the time.,,,,,,,,,,0,0,0,0,0,0
There is too much that goes good when you first get the small cell lung thing.,,,,,,,,,,11,1,1,200,2,3
It is the second stage when things start to go south and you react.,,,,,,,,,,1-Jan,1,0,2000-10,-1,1
#############################################,,,,,,,,,M,#,#,#,#,#,#
I have had a persistent cough for months now and was referred to a ENT.,,,,,,,,,,0,1,0,2000-10,-1,1
He put a camera in to look at my voice box etc and said I needed to get a CT scan.,,,,,,,,,,0,0,0,0,0,2
CT scan was completed and the results are below.,,,,,,,,,,0,1,1,100,1,2
He has now referred me to a Thoracic surgeon.,,,,,,,,,,0,0,0,0,0,2
Could anyone help with thoughts or suggestions? - Subcarinal lymph node measures 12 mm. Left hilar lymph node measures 16 x 13 mm - Nodules noncalcified bilaterally largest 6.1mm (one if right upper lobe right middle lobe lower left lobe and left upper lobe) - left adrenal lesion (21 x 20 mm) is not an adenoma.,,,,,,,,,,0,0,0,0,0,1
#############################################,,,,,,,,,M,#,#,#,#,#,#
sounds like they are still determining your condition.,,,,,,,,,,0,1,1,100,1,2
I wish you peace and understanding.,,,,,,,,,,11,1,1,100,1,3
#############################################,,,,,,,,,F,#,#,#,#,#,#
The journey for my father in law is just begining.,,,,,,,,,,0,1,0,2000-10,-1,0
We just have the lung cancer dx ..no stage but its in the lymp nodes in the center of the chest and possibly by the face.,,,,,,,,,,0,0,0,0,0,1
He is 73 and has a heart issues (high blood pressure and a couple of heart attacks).,,,,,,,,,,1-Jan,1,0,2000-10,0,0
While I am very aware that every journey is different ( I am St 4 colon NED for almost 7 yrs ) can any one give me a heads up on whats coming for him.,,,,,,,,,,0,0,0,0,0,0
When my mom passed in 89 of st 4 lung cancer it was 2 1/2 months from dx to passing.,,,,,,,,,,0,0,0,0,0,1
I need to know there is some more hope than it was in 89.,,,,,,,,,,0,0,0,0,0,2
#############################################,,,,,,,,,M,#,#,#,#,#,#
Things have improved immeasurably since 1989.,,,,,,,,,,11,1,1,100,1,3
In the last 1.5 years we've seen seven new targeted therapies and precision therapies receive approval.,,,,,,,,,,0,1,0,100,1,2
The drug Keytruda that helped Jimmy Carter so much for his a stage 4 melanoma with mets to brain has recently been approved for first line treatment in lung cancer.,,,,,,,,,,11,1,1,100,1,2
#############################################,,,,,,,,,F,#,#,#,#,#,#
Unfortunately I have experienced this with my brother.,,,,,,,,,,1-Jan,1,0,0000-20,-2,3
By the time he was diagnosed the lung cancer spread everywhere nothing could be done.,,,,,,,,,,1-Jan,1,0,0000-20,-2,1
He didn't want to believe it and tried to find Drs. Who would treat him. No one would except to help manage pain.,,,,,,,,,,0,1,0,0000-20,-2,2
He died 4 months after diagnosis.,,,,,,,,,,0,1,0,2000-10,-1,1
I know what you are dealing with and I am sorry you have to go through it.,,,,,,,,,,1-Jan,1,0,0000-20,-2,3
#############################################,,,,,,,,,M,#,#,#,#,#,#
If your mom has a mutation that has a targeted medication for it she may respond well to treatment.,,,,,,,,,,0,1,1,100,1,2
The mutations I am looking for are EGFR (Tarceva) or ALK and ROS1 (Xalkori).,,,,,,,,,,0,0,0,0,0,2
Occasionally patience with a poor performance score patients who are unable to get out of bed to reach a commode without help with have been known to have a 'miraculous' response.,,,,,,,,,,11,1,0,100,1,2
If she is too weak to have a standard biopsy she can request a liquid one.,,,,,,,,,,0,1,1,100,1,3
#############################################,,,,,,,,,F,#,#,#,#,#,#
Hi I had surgury Oct 30th 2015 on lower left lobectomy.,,,,,,,,,,0,0,0,0,0,2
I did not have to have radiation or chemo.,,,,,,,,,,0,0,0,0,0,2
It was smaller than a stage one cancer.,,,,,,,,,,0,0,0,0,0,0
I thank God for that and appreciate all the prayers.,,,,,,,,,,11,1,0,200,2,3
I do however have a situation that I would like to see if anyone has been thru before.,,,,,,,,,,0,0,0,0,0,0
It seems that the vegas nerve was damaged and the diaphragm for the left side is paralized.,,,,,,,,,,0,1,0,2000-10,-1,1
I cannot walk and talk at the same time.,,,,,,,,,,0,1,0,2000-10,-1,1
I get out of breath and cannot exert myself.,,,,,,,,,,1-Jan,1,0,2000-10,-1,1
I have trouble with normal everyday things.,,,,,,,,,,1-Jan,1,0,2000-10,-1,1
The surgeon wanted to see if it would improve so I have been dealing with this for 1 year.,,,,,,,,,,0,0,0,0,0,2
"The surgeon now says that they can go back in and do a surgery to ""shorten"" the diaphragm to see if that would aleiviate the problem.",,,,,,,,,,0,0,0,0,0,2
I would like to know if anyone has had this proceedure and if it helped.,,,,,,,,,,0,0,0,0,0,0
I think it is called diaphragm plication.,,,,,,,,,,0,0,0,0,0,2
Any comments would be appreciated.  Thanks and wellness to all.,,,,,,,,,,11,1,1,100,1,0
#############################################,,,,,,,,,M,#,#,#,#,#,#
You might want to ask this question on the boards at cancergrace.org.,,,,,,,,,,0,1,1,100,1,3
It is monitored phys oncologists from a number of NCCN designated Cancer Care Centers of Excellence.,,,,,,,,,,0,1,1,100,1,3
#############################################,,,,,,,,,F,#,#,#,#,#,#
Hello..my boyfriend has Stage IV NSCLC also and is on his 8th whole brain radiation treatment.,,,,,,,,,,0,1,0,100,-1,2
He is doing remarkable well.,,,,,,,,,,11,1,1,200,2,0
Functions just fine.,,,,,,,,,,11,1,1,200,2,0
Drives himself to his treatments.,,,,,,,,,,0,1,1,100,1,0
Appetite isn't as good as it was but he still eats.,,,,,,,,,,1-Jan,1,0,2000-10,-1,1
Quite tired at the end of the day and he does take a nap in the aft. He is only 39 yrs. old.,,,,,,,,,,1-Jan,1,0,0000-20,-2,1
Is your mother taking steroids to reduce the swelling in the brain? My boyfriend is and they say that one of the side effects may be lethargy.,,,,,,,,,,0,1,1,100,1,1
I have noticed that my boyfriend has a short temper and snaps at me more than usual.,,,,,,,,,,0,1,0,2000-10,-1,1
They say that is a side effect of the steroid also.,,,,,,,,,,0,1,0,2000-10,-1,1
Sorry I don't have more info for you but this is what I have experienced so far.,,,,,,,,,,1-Jan,1,0,2000-10,-1,3
#############################################,,,,,,,,,F,#,#,#,#,#,#
My husband had an olglodendrone glimoa removed at the end of Dec. He had subsequent radiation and is about to do last 5 day/ 28 day apart cycle of temodar.,,,,,,,,,,0,0,0,0,0,2
The Mri is showing increased area of concern they are currently unsure if it is tumor or necrosis.,,,,,,,,,,0,1,0,00-2000,-2,2
How fast do we have to react to this to stop the damage from increasing. Can the damage be reversed.,,,,,,,,,,0,0,0,0,0,0
I am so stressed with the timeline for the next Mri that is scheduled.,,,,,,,,,,1-Jan,1,0,00-2000,-2,0
They have him waiting six weeks.,,,,,,,,,,0,0,0,0,0,2
He has had a marked increase in weakness and his immune system is nonexistant.,,,,,,,,,,1-Jan,1,0,00-20-20,-2,1
He has now presented with shingles.,,,,,,,,,,0,0,0,0,0,1
He feels worse now that he did two weeks ago.,,,,,,,,,,1-Jan,1,0,2000-10,-1,1
#############################################,,,,,,,,,F,#,#,#,#,#,#
Hi my name is June.,,,,,,,,,,0,0,0,0,0,0
I was a healthy and vibrant 53 yo when II was dx with stage lV lung Ca last Nov 2015.,,,,,,,,,,11,1,0,2000-10,-1,1
It started out as a back spasm.,,,,,,,,,,0,0,0,0,0,3
So much pain had to go to ER. A CT was done of chest and found a 1.0 cm spot  in rt upper lung.,,,,,,,,,,1-Jan,0,0,0,0,1
I was admitted and bx done showed adenocarcinoma of lung. PET showed lymph nodes affected in trachea area. Next step MRI showed 1 4x7x4 lesion of brain.,,,,,,,,,,0,1,0,2000-10,-1,1
I was put on 3 rounds of IV Chemo x 1 dose @ 3 weeks.,,,,,,,,,,0,0,0,0,0,2
Spot rad knocked out lesion  then I had a rt upper lobectomy.,,,,,,,,,,0,0,0,0,0,2
Since then I had a M RI in  Feb 2016 showedv2 more lesions.,,,,,,,,,,0,0,0,0,0,1
They were zapped as well.  Last MRI showed 5 more lesions <5mm. Had WBRT end of June for 10 days.,,,,,,,,,,0,0,0,0,0,1
If that isnt enough  I got pneumonia last month and almost every joint in my body aches....mostly upper back..deep stabbing pains.,,,,,,,,,,1-Jan,1,0,2000-10,0,1
Hips feel like Im 90.,,,,,,,,,,0,1,0,2000-10,-1,1
No steroids and no swelling of brain.,,,,,,,,,,0,1,1,100,1,0
I do have trouble sleeping have to lay on back...sex??? extremely painful everyway I turn there is stiffness and pain.,,,,,,,,,,1-Jan,1,0,0000-20,-2,1
If I didnt take 1800mg of Motrin and 60mg of oxycodone daily.,,,,,,,,,,0,0,0,0,0,2
I could not function.,,,,,,,,,,0,0,0,0,0,0
Next fu MRI and PET in Dec ..  Im not complaining but I wish someone would have warned me...I get by daily thanks to my wonderful Mom and friend support system and mostly GOD.,,,,,,,,,,11,1,1,100,1,2
I know he wont let me down. Im doing OK today and tryibg to be positive.,,,,,,,,,,11,1,1,100,1,3
Im glad I found this website and I am not the only one going through this Best of luck and take care!!,,,,,,,,,,11,1,1,100,1,0
#############################################,,,,,,,,,M,#,#,#,#,#,#
Chemo/radiation/surgery and other evidence-based treatments have proven that one can fight with cancer.,,,,,,,,,,0,1,1,100,1,2
