######################################,,,,,,,,,M,,EMO/NEU,POS/NEG,EMOTION,VALENCE,0-None 1- side-effect 2-Therapy 3-Sympathy-Empathy
#############################################,,,,,,,,,M,#,#,#,#,#,#
Your story caught my eye my husband just underwent an upper right lobectomy in February.,,,,,,,,,,0,1,0,2000-10,-1,0
He is going back to work tomorrow on his surgeon's advice.,,,,,,,,,,0,0,0,0,0,0
I worry it's too early as he too has pain especially in his ribcage where the tubes were.,,,,,,,,,,1-Jan,1,0,00-1000,-1,1
When did you have your lobectomy?,,,,,,,,,,0,0,0,0,0,0
His incision is still swelled and  a little red surgeon said it's just inflamation and normal.,,,,,,,,,,0,0,0,0,0,1
He too gets tired quicker than he use too.,,,,,,,,,,1-Jan,1,0,2000-10,-1,1
They say it takes a year to heal completely starting to believe it.,,,,,,,,,,0,1,1,2001-10,1,2
#############################################,,,,,,,,,M,#,#,#,#,#,#
I had a left upper lobectomy 18 mos. ago and I feel wonderful today.,,,,,,,,,,11,1,1,200,2,3
Give yourself time to heal and be patient.,,,,,,,,,,0,1,1,100,1,3
I was a good ten weeks before I felt like a human again.,,,,,,,,,,11,1,1,100,1,3
Today I walk 2 miles a day.,,,,,,,,,,0,1,2,100,1,0
I guess I was lucky I never had trouble breathing.,,,,,,,,,,11,1,1,100,1,1
I get shortwinded climbing stairs and doing physical work.,,,,,,,,,,1-Jan,1,1,100,1,0
It was a very painful recovery but I tried to walk in the house a little bit each day.,,,,,,,,,,1-Jan,1,0,2000-10,-1,2
During recovery from surgery I felt very lonely a lot of times altho I had a wonderful supportive family and friends.,,,,,,,,,,1-Jan,1,0,00-10-20,-2,1
I also experienced depressionanxiety and crying jags.,,,,,,,,,,1-Jan,1,0,00-20-20,-2,1
My Doctor put me on antidepressant medicine and it has made a big difference.,,,,,,,,,,0,1,1,100,1,2
Also  these feelings are normal. Our bodies have gone thru a major trama undergoing major surgery.,,,,,,,,,,0,0,0,0,0,3
The biggest thing I found was to listen to my body.,,,,,,,,,,0,0,0,0,0,2
Rest when you are tired cry when you are sad talk when you need to.,,,,,,,,,,0,1,1,100,1,3
One day you will feel like a brand new person.,,,,,,,,,,11,1,1,100,1,3
Hope This helped you.,,,,,,,,,,11,1,1,100,1,3
If you have any more questions I will be glad to talk with you.,,,,,,,,,,11,1,1,100,1,3
I am a 59 year old female.,,,,,,,,,,0,0,0,0,0,0
#############################################,,,,,,,,,M,#,#,#,#,#,#
"You may wish to start a new post instead of replying to ones that are more than a month or two ""old"".",,,,,,,,,,0,0,0,0,0,0
Folks come and go quickly on a board and old posts rarely get checked so you don't get replies to your questions.,,,,,,,,,,0,1,0,-1010,-1,0
#############################################,,,,,,,,,M,#,#,#,#,#,#
I hope you are doing well with your operation.,,,,,,,,,,11,1,1,100,1,3
It is normal to take pain meds for about a month after major surgery.,,,,,,,,,,0,1,1,100,1,3
If you had VATS surgery you should soon be ready to take over-the-counter meds instead of the prescription stuff.,,,,,,,,,,0,1,1,100,1,3
It may take longer if you had conventional surgery.,,,,,,,,,,0,1,1,100,1,3
#############################################,,,,,,,,,F,#,#,#,#,#,#
I am at stage 1a too both for breast cancer and for lung cancer.,,,,,,,,,,0,0,0,0,0,0
I met with a pulmonary oncologist once but she said I was too healthy to see her!!,,,,,,,,,,11,1,0,00000-1,-1,2
I still see my breast oncologist as they have preventitive meds for that I can take.,,,,,,,,,,0,0,0,0,0,2
I sure wish there were medical ways to prevent future episodes of lung cancer too.,,,,,,,,,,11,1,0,00-10-10,-1,0
Exercise and good diet is about all I see supported by research as a way to stay out of the operating room.,,,,,,,,,,0,1,1,100,1,2
#############################################,,,,,,,,,F,#,#,#,#,#,#
I just came to this site to possibly get more info on recovery after a lobectomy.,,,,,,,,,,0,0,0,0,0,0
I noticed the dates from the posts so I am not sure I am in the right spot.,,,,,,,,,,0,1,0,00-1000,-1,0
I also read the other person saying maybe would be better to start a new post.,,,,,,,,,,0,0,0,0,0,0
I haven't done this before and haven't been on this site for discussion boards either.,,,,,,,,,,0,0,0,0,0,0
So being new to this I will keep checking out what is available.,,,,,,,,,,0,0,0,0,0,0
#############################################,,,,,,,,,F,#,#,#,#,#,#
I had upper left lobe removed on 2-28-11 and working on the recovery process.,,,,,,,,,,11,0,0,0,0,2
No further treatment for the lung cancer is needed.,,,,,,,,,,0,1,0,0,0,2
I had a triple bypass late 1998 and lumpectomy for breast cancer which was in a lymph node also; and breast reduction a year ago.,,,,,,,,,,0,0,0,0,0,2
Still taking meds for that after radiation.,,,,,,,,,,0,0,0,0,0,2
#############################################,,,,,,,,,F,#,#,#,#,#,#
This surgery is more painful and I a guess I am just looking for more info on recovery from the surgery.,,,,,,,,,,1-Jan,1,0,00-1000,-1,1
#############################################,,,,,,,,,F,#,#,#,#,#,#
I was 45 years old when I had my lobectomy in Sept. 2009.,,,,,,,,,,0,0,0,0,0,0
I have always been in good shape and I was quite shocked to learn I had a mass the size of Rhode Island in my right lung.,,,,,,,,,,1-Jan,1,0,0000-20,-2,1
The mass was making me very sick and it had just about destroyed my upper right lung so they did a lobectomy.,,,,,,,,,,1-Jan,1,0,2000-10,-1,1
Long story short it was not cancer but a severe infection.,,,,,,,,,,0,1,0,2000-10,-1,0
I did not have the VATS so I have a big ugly scar but I am OK with that.,,,,,,,,,,1-Jan,1,0,2000-10,-1,1
#############################################,,,,,,,,,F,#,#,#,#,#,#
The recovery from the surgery took a lot longer than I expected.,,,,,,,,,,1-Jan,1,-1,2000-10,-1,1
I was on hydrocodone for about 6 weeks after the surgery and ibuprophen for a few weeks after that.,,,,,,,,,,0,0,0,0,0,2
Even now I still have some discomfort here and there but it's not bad.,,,,,,,,,,1-Jan,1,0,2000-10,0,1
#############################################,,,,,,,,,F,#,#,#,#,#,#
Do not be surprised if you gasp from time to time.,,,,,,,,,,0,0,0,0,0,1
It took at least 3-4 months for the gasping to stop happening frequently meaning several times an hour.,,,,,,,,,,0,1,0,2000-10,0,1
It still happens once or twice a day but not every day.,,,,,,,,,,0,1,0,2000-10,-1,1
#############################################,,,,,,,,,M,#,#,#,#,#,#
I found it much more comfortable to sleep sitting up.,,,,,,,,,,11,1,0,100,1,2
I did this for about 3 months after surgery.,,,,,,,,,,0,0,0,0,0,2
If you don't have a bed that raises up like a hospital bed you might want to invest in a good chair-pillow.,,,,,,,,,,0,0,0,0,0,3
#############################################,,,,,,,,,M,#,#,#,#,#,#
Today I am 47 years old and I'm working on getting back in shape.,,,,,,,,,,0,0,0,0,0,0
I do my stair stepper almost every day and I take the stairs to my 8th floor office.,,,,,,,,,,0,0,0,0,0,2
There is healing from this surgery. It might be slower than you hope but it will come.,,,,,,,,,,11,1,1,100,1,3
#############################################,,,,,,,,,F,#,#,#,#,#,#
If I can answer any more questions I will be happy to do so.,,,,,,,,,,11,1,1,100,1,3
All the best to you in your recovery.,,,,,,,,,,11,1,1,100,1,3
#############################################,,,,,,,,,F,#,#,#,#,#,#
Thank you PBJ Austin for the reply.,,,,,,,,,,11,1,1,100,1,0
I don't know the term VATS but I have a big ole scar across the left upper back and some drain tube scars (ouch) under my left arm kind of on top of the incisions from the breast cancer.,,,,,,,,,,0,0,0,0,0,1
The doctors and others have told me that this is about the most painful surgery you can have so I thought I was prepared enough I thought I would be off the RX pain meds after 2 weeks out of the hospital but I have tried the regular over the counter and it doesn't even dull the pain most of the time.,,,,,,,,,,1-Jan,1,0,0000-20,-2,1
I really don't like having to have my husband do the cooking and things I usually do.,,,,,,,,,,1-Jan,1,1,2000-10,-1,0
He is happy to be of some kind of help so I should just relax and let myself heal in the time it takes.,,,,,,,,,,11,1,1,100,1,0
#############################################,,,,,,,,,F,#,#,#,#,#,#
It does help though to hear from others that have had the same done and how it effected them.,,,,,,,,,,1-Jan,1,1,100,1,0
I am not in as good of shape or as young as you were when you had your surgery but I have bounced back after my other surgerys pretty quickly.,,,,,,,,,,11,1,1,100,1,3
#############################################,,,,,,,,,F,#,#,#,#,#,#
Well again thank you so much for your reply.,,,,,,,,,,11,1,1,100,1,3
I am glad you are doing so well and that you didn't have a hugh mass of cancer. Very fortunate.,,,,,,,,,,11,1,1,200,1,3
My lung cancer was caught at a very early stage due to a scheduled CT 6 months after a bad case of pneumonia during last summer as a f-up scan.,,,,,,,,,,0,1,1,100,1,0
At that time they saw a new spot that had not been there during the illness in the summer.,,,,,,,,,,0,0,0,0,0,1
I was very lucky but it was in a bad spot so they had to take the whole upper left lobe.,,,,,,,,,,11,1,1,2001-10,1,2
At the time they were not absolutly sure it was cancer but pretty certain from the Pet Scan.,,,,,,,,,,0,0,0,0,0,2
It was but caught very early so I am lung cancer free now.,,,,,,,,,,0,1,1,100,1,0
#############################################,,,,,,,,,M,#,#,#,#,#,#
Well gees too many words. whew wore me out! Thanks Again.,,,,,,,,,,11,1,1,200,2,0
#############################################,,,,,,,,,F,#,#,#,#,#,#
Thank u for your candid post on your experience.,,,,,,,,,,11,1,1,100,1,0
I had upper left lobectomy 2/9 and am going thru the same feelings.,,,,,,,,,,0,1,0,2000-10,-1,1
A little lonely being at home and trying to do activities in the house to keep me active.,,,,,,,,,,1-Jan,1,1,100,1,0
I am lucky to have friends checking on me ss well ss my 20 and 22 year olds who are home in the evening.,,,,,,,,,,11,1,1,100,1,0
I though I'd recooperate sooner but its a slow recovery.,,,,,,,,,,0,1,0,00000-1,-1,2
I am 53 and was very active before my cancer reoccurence-ugh!,,,,,,,,,,11,1,0,-1010,-1,0
And surprised the way it came back but lucky it was found!,,,,,,,,,,11,1,0,00020-1,2,0
#############################################,,,,,,,,,F,#,#,#,#,#,#
My big concern is I have to have my other lung wedged and at that time a liver tumor will be removed so I hope to heal by end of month.,,,,,,,,,,1-Jan,1,0,00-20-10,-2,2
I see the liver surgeon March 15.,,,,,,,,,,0,0,0,0,0,0
#############################################,,,,,,,,,F,#,#,#,#,#,#
Anyone other thoughts on healing from this surgery?,,,,,,,,,,0,0,0,0,0,0
#############################################,,,,,,,,,M,#,#,#,#,#,#
I am trying to remain positive but the rib pain sure can hurt.,,,,,,,,,,1-Jan,1,0,2000-10,0,1
I sm on ibuprofen q/4 hours and take a Norco at night when pain peaks.,,,,,,,,,,1-Jan,0,0,0,0,2
#############################################,,,,,,,,,M,#,#,#,#,#,#
I had my right middle lobe removed Dec 3rd and NOT by the VATs procedure so it is a completly diferent recovery..,,,,,,,,,,11,0,0,0,0,2
I too thought I was ready to deal with the pain but this knocked me off my feet..,,,,,,,,,,1-Jan,1,0,00000-1,-1,1
I returned to work part-time the middle of feb but was still taking vicoden at night and exhausted by the time I would get home from work..,,,,,,,,,,1-Jan,1,0,2000-10,-1,1
I am 51 years old and in good health and my tumor was found on a routine chest x-ray have been staged 1a but will continue to be followed by an oncologist.,,,,,,,,,,0,0,0,0,0,2
#############################################,,,,,,,,,F,#,#,#,#,#,#
I spent hours on web sites looking at recovery time frames for this surgery and it takes alot longer than most of us were led to believe by our surgeons..,,,,,,,,,,11,1,0,00000-1,-1,1
I still take extra strength tylenol 3 times a day and don't even get me started on what its like to wear a bra!,,,,,,,,,,1-Jan,1,0,2000-10,-1,2
I do feel better than you do at 6 weeks out but please be patient with yourself continue to do your breathing exercises walk when you can get as much sleep as you can (I take lunesta at night as I feel better in the day if I get a good nights sleep) and it will get better but it is a slooooooow process.,,,,,,,,,,11,1,1,100,1,3
#############################################,,,,,,,,,F,#,#,#,#,#,#
What is the VATS procedure? I haven't read enough apparently and the surgeons office never mentioned it.,,,,,,,,,,0,0,0,0,0,0
All I know is I have a large incision on my upper back and holes on the side where the drain tubes.,,,,,,,,,,0,0,0,0,0,1
I am sure it is going to take longer than I though for sure.,,,,,,,,,,0,1,0,2000-10,-1,0
I had a triple bypass when I was 50 and I don't remember it being this bad and was back to work after about 4 weeks.,,,,,,,,,,1-Jan,1,0,0000-20,-2,1
I am 63 now and had surgery for breast cancer early last year with radiation and now this.,,,,,,,,,,0,0,0,0,0,0
I think my body is getting a bit tired of being cut on. At least I am now retired and don't have to go back to work like before.,,,,,,,,,,1-Jan,0,0,0,0,1
#############################################,,,,,,,,,F,#,#,#,#,#,#
But summer is just around the corner and there are grandkids (17) I want to see so the recovery will have to speed it up a bit.,,,,,,,,,,11,0,0,0,0,1
I am working on it at least.,,,,,,,,,,11,0,0,0,0,0
#############################################,,,,,,,,,F,#,#,#,#,#,#
VATS is video assisted thoracic surgery.,,,,,,,,,,0,0,0,0,0,0
That is how I had my right lower lobe removed.,,,,,,,,,,0,0,0,0,0,2
It is more of a laproscopic surgery.,,,,,,,,,,0,0,0,0,0,0
I had 2 small incisions (one on lower back and one of right side) about 1 inch and then a larger 3-4 inch incision (on side and rounding under breast) and a drain tube (under breast).,,,,,,,,,,0,0,0,0,0,2
I have a total of 4 scars from the surgery with the largest being the 3-4 inch one.,,,,,,,,,,0,0,0,0,0,1
#############################################,,,,,,,,,F,#,#,#,#,#,#
I had surgery 8 weeks ago and I still have minor pain in the incision areas an if i move wrong it hurts.,,,,,,,,,,1-Jan,1,0,2000-10,-1,1
However VATS is a much smaller surgery than an open type like you indicated.,,,,,,,,,,0,0,0,0,0,2
I did notice an increase in incision pain since I started chemo.,,,,,,,,,,11,1,0,2000-10,-1,1
#############################################,,,,,,,,,F,#,#,#,#,#,#
Hi everyone. I am a 55 year old female and I had the lower lobe of my left lung removed 8 weeks ago.,,,,,,,,,,0,0,0,0,0,0
My cancer was also stage 1a ? no chemo or radiation required.,,,,,,,,,,0,0,0,0,0,2
Even though I had VATS I am still in a great deal of discomfort.,,,,,,,,,,11,1,0,-2020,-2,1
I have a total of 5 incisions ? 4 small and 1 longer one on my side.,,,,,,,,,,0,0,0,0,0,0
Surgeons had to remove a portion of one of my ribs in order to get the lobe out.,,,,,,,,,,0,0,0,0,0,2
The pain is mostly in the muscles in my back and around my rib cage now ...,,,,,,,,,,1-Jan,1,0,-1010,-1,1
I feel battered and bruised all around that area. Sleeping is difficult.,,,,,,,,,,1-Jan,1,0,-2020,-2,1
I went back to work this week but feel like I could use another few weeks off!,,,,,,,,,,0,0,0,0,0,0
#############################################,,,,,,,,,F,#,#,#,#,#,#
I agree with sissylu1 ? it does take a lot longer to recover than our surgeons lead us to believe.,,,,,,,,,,0,1,0,0000-20,-2,3
I know it is definitely taking a lot longer than I thought it would! I don't think anyone knows until they've been through it which is why this discussion board is so great!,,,,,,,,,M,11,1,0,2000-10,-1,3
#############################################,,,,,,,,,,#,#,#,#,#,#
Sounds like we just need to be patient. God bless us all ...,,,,,,,,,,11,1,1,100,1,3
#############################################,,,,,,,,,M,#,#,#,#,#,#
Friends I don't want to contradict any advice your doctors have given you since every case is different.,,,,,,,,,,0,0,0,0,0,0
But when I was trying to wean myself off hydrocodone I tried Extra Strength Tylenol and it did nothing for me at all.,,,,,,,,,,1-Jan,1,0,2/2/2000,-2,2
I called the doc and he said forget Tylenol it won't help. He recommended ibuprophen.,,,,,,,,,,1-Jan,0,0,0,0,2
#############################################,,,,,,,,,M,#,#,#,#,#,#
Please ask your doctor which pain reliever is best and do not make any changes on my advice this is simply what I was told.,,,,,,,,,,0,1,1,100,1,0
#############################################,,,,,,,,,F,#,#,#,#,#,#
And don't be discouraged if the pain or breathlessness lasts longer than the surgeon predicted.,,,,,,,,,,11,1,1,100,1,3
The same happened to me.,,,,,,,,,,0,1,1,100,1,3
Don't push yourself your body will heal when it is ready.,,,,,,,,,,0,1,1,100,1,3
And do keep believing that your strength will come back but these things take time.,,,,,,,,,,11,1,1,100,1,3
There is life after lobectomy.,,,,,,,,,,0,1,1,100,1,3
#############################################,,,,,,,,,F,#,#,#,#,#,#
Gentle hugs to all who are recovering from this surgery.,,,,,,,,,,11,1,1,100,1,3
#############################################,,,,,,,,,F,#,#,#,#,#,#
You are so right about the bra issue grama17! I also went the tank with a shelf-bra route.,,,,,,,,,,0,1,1,100,1,3
"I did find that ""Barely There"" makes a couple of very stretchy bras that work out pretty good when I want just a little extra (but not too much extra) support.",,,,,,,,,,11,1,0,2000-10,-1,3
#############################################,,,,,,,,,F,#,#,#,#,#,#
Well not sure you are still on? Came to this site for info.,,,,,,,,,,0,0,0,0,0,0
Have not had my surgery yet.,,,,,,,,,,0,0,0,0,0,0
Very interesting. I am the kind of person who wants to know what might lay ahead of me! I want to be pre-pared I know I will want things to move along quickly as far as recuperating.,,,,,,,,,,0,1,1,100,1,0
I have a goal! We have plans for a trip to Hawaii the end of Oct. ,,,,,,,,,,0,0,0,0,0,0
Which will be just 3months out from surgery.,,,,,,,,,,0,0,0,0,0,0
Won't know if any of my lung will actually have to be removed or how much if that? So what can I expect? Should we cancel our plans?,,,,,,,,,,0,0,0,0,0,0
#############################################,,,,,,,,,F,#,#,#,#,#,#
My husband actually had 2 surgeries- a right upper lobectomoy jan. 2011 and then a lower left lobectomoy March 25th and then a second surgery April 8th to repair a leak that had occurred as a complication from surgery- was in the hospital a total of 3 weeks.,,,,,,,,,,1-Jan,1,1,100,1,2
A collapsed lung May 4th. BUT on July 1st we boarded a plane and went to Mexico for 2 weeks.,,,,,,,,,,0,1,1,100,1,2
No problems with his breathing on the flight there and back. Keep your plans!,,,,,,,,,,0,1,1,100,1,3
#############################################,,,,,,,,,F,#,#,#,#,#,#
I am exactly the same way and I do not like surprises...,,,,,,,,,,0,1,0,2000-10,-1,3
anyway I had the middle lobe of my right lung removed the old fashioned way on Dec 3 2010 and I asked a ton of questions about how long I would be off pain level etc...,,,,,,,,,,0,0,0,0,0,0
"what you will keep hearing is ""it's different for everyone"" which is not the answer I wanted to hear.",,,,,,,,,,0,1,0,-1010,-1,0
My second child was graduating in June of 2011 and we wanted to go to Hollywood CA for a graduation trip...,,,,,,,,,,0,1,1,100,1,0
me being the pre planner that I am I already wanted things in place..,,,,,,,,,,0,0,0,0,0,3
then I started to panic that I would not be up for the trip or that I would not be able to keep up with her.,,,,,,,,,,1-Jan,1,0,2000-10,-1,3
#############################################,,,,,,,,,F,#,#,#,#,#,#
We just got back the beg of July and had a wonderful time..,,,,,,,,,,11,1,1,200,2,3
now keep in mind that is 6 months out but I really started to feel back to my old self by May..,,,,,,,,,,0,1,1,100,1,2
having a goal is a good thing to strive for..,,,,,,,,,,11,1,1,100,1,3
you might not be able to do EVERYTHING that you wanted but you can still have a wonderful trip..ps I did buy the trip insurance just in case.,,,,,,,,,,11,1,1,100,1,3
#############################################,,,,,,,,,M,#,#,#,#,#,#
Everyone's case is different..,,,,,,,,,,0,1,1,100,1,3
the VATS is a shorter recovery time..,,,,,,,,,,0,1,1,100,1,3
I had my surgery the traditional way..,,,,,,,,,,0,0,0,0,0,2
if I were you I would plan on being off for a month-if you have VATS that may be a reasonable time period to plan for if you wind up going back to work sooner than that you could do so...,,,,,,,,,,0,1,1,100,1,2
I know how hard it is to plan with this kind of thing but plan for longer than expected so you don't have the anxiety of a deadline date to return to work and let others help you when you get home!!!!!!!,,,,,,,,,,1-Jan,1,1,100,1,3
Please keep us posted.,,,,,,,,,,0,1,1,100,1,3
#############################################,,,,,,,,,M,#,#,#,#,#,#
In late 2012 through a miraculous fluke it was discovered that I have a very large (46mm) aneurysm at the aortic root.,,,,,,,,,,1-Jan,1,1,200,2,1
In the MRI scans they did to evaluate it some small nodules were spotted in my lung.,,,,,,,,,,0,0,0,0,0,1
After a followup CT scan and a biopsy lung cancer was confirmed.,,,,,,,,,,0,0,0,0,0,2
In Feb. 2013 I had surgery to remove one lobe of my lung.,,,,,,,,,,0,0,0,0,0,2
Due to the very early stage of development I did not have to have either chemotherapy or radiation therapy.,,,,,,,,,,0,0,0,0,0,2
Long term prognosis is excellent.,,,,,,,,,,11,1,1,100,1,3
I get annual CT scans but the surgeon says the likelyhood of recurrance is very low.,,,,,,,,,,11,1,1,100,1,0
#############################################,,,,,,,,,M,#,#,#,#,#,#
Initially I was thankful that my cancer had been detected so early and that I did not have to have followup treatment.,,,,,,,,,,11,1,1,100,1,0
I hapilly participated in Relay for Life events.,,,,,,,,,,11,1,1,100,1,0
However I am now embarassed to claim survivorship.,,,,,,,,,,0,1,0,0000-20,-2,0
Everyone I know who has had cancer have had to endure not only surgery but extensive and debilitating followup treatment.,,,,,,,,,,0,1,0,0000-20,-2,3
I was fortunate to only had to have surgery.,,,,,,,,,,11,1,1,100,1,2
"I get the feeling that I do not qualify as a ""real survivor"" since I did not ""suffer enough"" while getting the followup treatment.",,,,,,,,,,1-Jan,1,0,2000-10,-1,0
So now I don't even mention I am a cancer survivior unless necessary.,,,,,,,,,,0,0,0,0,0,0
#############################################,,,,,,,,,M,#,#,#,#,#,#
I am only a caregiver but the way I see it - you still survived it.,,,,,,,,,,0,1,1,100,1,3
Your battle looked different sure but that does not matter. Not to me.,,,,,,,,,,1-Jan,1,1,100,1,3
I think it is awesome that they caught it so early and you were able to be rid of this beast with surgery alone.,,,,,,,,,,11,1,1,100,1,2
Congrats are in order! How much pain and agony you and your family were saved from!,,,,,,,,,,11,1,1,100,1,1
Personally I think you have a bit of survivor's guilt.,,,,,,,,,,0,1,1,100,1,3
Please do not beat yourself up about this.,,,,,,,,,,1-Jan,1,1,100,1,3
Take this blessing and live your life to the fullest.,,,,,,,,,,11,1,1,100,1,3
Take nothing for granted. Live laugh love.,,,,,,,,,,0,1,1,100,1,3
That's how you pay this back. Many your health continue and happiness surround you and yours.,,,,,,,,,,11,1,1,100,1,3
#############################################,,,,,,,,,M,#,#,#,#,#,#
I had anal cancer and completed tx on 6-30-2009 and because I was being scanned for follow up a 7mm lung nodule was found in my lower right lobe.,,,,,,,,,,0,0,0,0,0,1
Well upon rescan 2 months later it grew to 1.1 cm and had to come out.,,,,,,,,,,0,0,0,0,0,1
I had Stage 1a and a lower right lobe lobectomy via vats on 9-23-10.,,,,,,,,,,0,0,0,0,0,2
No chemo/rad for the lung.  I had chemo/rad for the anal.,,,,,,,,,,0,0,0,0,0,2
#############################################,,,,,,,,,M,#,#,#,#,#,#
I am a survior and a very lucky one at that.,,,,,,,,,,11,1,1,200,2,0
Often times lung cancer isn't detected until a later stage.,,,,,,,,,,0,0,0,0,0,0
#############################################,,,,,,,,, M,#,#,#,#,#,#
I consider myself a survivor of lung cancer.,,,,,,,,,,11,0,0,0,0,0
I too was diagnosed before stage 1 and left lower lobe was removed via VATS.  No chemo no radiation.,,,,,,,,,,0,0,0,0,0,2
I just considered that a plus to my blessing to be cancer free and survivor.,,,,,,,,,,11,1,1,100,1,0
Please do not think because we did not suffer as others do (I had a sister that suffered and did not make it) that we are not survivors.,,,,,,,,,,0,1,1,2001-10,1,3
Thank God that we got to it in time.,,,,,,,,,,11,1,1,100,1,3
Good luck and blessings to you!,,,,,,,,,,11,1,1,100,1,3
#############################################,,,,,,,,,M,#,#,#,#,#,#
I had my left lung removed 11 years ago because I had a carcinoid tumor.,,,,,,,,,,0,0,0,0,0,0
I had no followup treatment.,,,,,,,,,,0,0,0,0,0,2
I am getting used to using the term cancer but didn't for years.,,,,,,,,,,0,0,0,0,0,0
I also feel like I got really lucky to have been able to have surgery and no treatment.,,,,,,,,,,11,1,1,200,2,0
I have recently been attending exercise classes for survivors at a local organization.,,,,,,,,,,0,1,1,100,1,2
Just today I spent half of the class convincing myself I had the right to be there.,,,,,,,,,,0,1,1,100,1,3
I completely understand how you feel.,,,,,,,,,,11,1,0,2000-10,-1,3
#############################################,,,,,,,,,F,#,#,#,#,#,#
At age 66 9 months ago I had a VATS lobectomy for stage 1a adenocarcinoma.,,,,,,,,,,0,0,0,0,0,0
Upper right lobe was removed.,,,,,,,,,,0,0,0,0,0,0
No further treatment needed.,,,,,,,,,,0,0,0,0,0,2
They took out 8 nodes all were clear.,,,,,,,,,,0,0,0,0,0,2
The surgery pain from the incisions warranted pain meds for about 1.5 months.,,,,,,,,,,1-Jan,0,0,0,0,2
Mild pain/breast numbness for about 3 months.,,,,,,,,,,1-Jan,1,0,2000-10,-1,1
