######################################,,,,,,,,,M,,EMO/NEU,POS/NEG,EMOTION,VALENCE,0-None 1- side-effect 2-Therapy 3-Sympathy-Empathy
There are few documentaries on cannabis oil which have proven to be effective for cancer patients.,,,,,,,,,,11,1,1,100,1,2
It is full of nutrition and found to be effective and reduce side effects and helps to recover fast.,,,,,,,,,,11,1,1,100,1,2
I found Charlotte's web hemp oil effective.,,,,,,,,,,0,1,1,100,1,2
#############################################,,,,,,,,,M,#,#,#,#,#,#
Talk to your dr about a pain patch.,,,,,,,,,,0,1,1,100,1,3
I was on a similar pain management program.,,,,,,,,,,0,1,0,2000-10,-1,3
My primary car dr put me on the Fentanyl patch and I very rarely have to use anything for breakthrough pain.,,,,,,,,,,1-Jan,1,1,100,1,2
I was able to start getting exercise.,,,,,,,,,,0,0,0,0,0,3
Through exercise I was able to reduce my patch strength to 12mcg. The patch stays on for three days.,,,,,,,,,,11,0,0,0,0,2
Its much easier on the system and it worked better for me than oxycodone.,,,,,,,,,,11,1,1,100,1,2
#############################################,,,,,,,,,M,#,#,#,#,#,#
Had a CT in March and they found nodules in both of my lungs 3mm - 8mm.,,,,,,,,,,0,1,0,2000-10,-1,1
Follow up scan in June 72 days later the nodules had double in size with the 8mm staying the same.,,,,,,,,,,0,1,0,2000-10,-1,1
Family Dr wants to wait 6 months and see if the nodules grow anymore??????,,,,,,,,,,0,0,0,0,0,2
I know they are small but they doubled in 72 days.,,,,,,,,,,0,1,0,2000-10,-1,1
#############################################,,,,,,,,,M,#,#,#,#,#,#
Get an oncologist and another doctor.,,,,,,,,,,0,1,0,2000-10,-1,3
Would he wait? NO@! I dont want to scare you but dont think all doctors give you the correct advice.,,,,,,,,,,0,1,0,2000-10,-1,3
I made that mistake and now im stage IV when I could have been stage 1 or 2 if I would have questioned the doctors the first time.,,,,,,,,,,1-Jan,1,0,0000-20,-2,3
Get a second and 3rd opinion if your still not satisfied.,,,,,,,,,,0,1,1,100,1,2
I learned the hard way dont make the same mistake.,,,,,,,,,,1-Jan,1,0,0000-20,-2,3
#############################################,,,,,,,,,F,#,#,#,#,#,#
"Definitely don't wait!  Fortunately my primary doc kept pushing for the next step.  It was first a ""spot"" on lung.",,,,,,,,,,11,1,1,100,1,1
She then ordered a CT and it showed it was a 11mm nodule.,,,,,,,,,,0,0,0,0,0,1
She then ordered a PET scan.,,,,,,,,,,0,0,0,0,0,2
Even though that showed no activity she then ordered a bioposy.,,,,,,,,,,0,0,0,0,0,2
The doc doing biopsy could get only one sample from nodule because it was pretty small and that sample came back negative.,,,,,,,,,,0,0,0,0,0,2
"Even though that came back negative she called me and said that she was going to the next step and send me to a thoracic surgeon to ""make sure"".",,,,,,,,,,0,0,0,0,0,2
I went in to see him and he immediately said he was 99% sure it was cancer.,,,,,,,,,,0,0,0,0,0,1
I was in surgery the next week had my follow up just a few days ago and confirmed it was cancer!  Very low grade very slow growing.,,,,,,,,,,0,0,0,0,0,1
I am one of the lucky ones; I'm cancer free now but still need my follow up CTs every 6 months for two years and then one a year after that util the 5 year mark.,,,,,,,,,,11,1,1,200,2,2
BUt if my primary care doc wouldn't have pushed for each step who knows what would have happened.,,,,,,,,,,0,1,0,00-1000,-1,0
I owe her a huge thank you.  DONE'T WAIT!!!!!!,,,,,,,,,,11,1,1,100,1,3
#############################################,,,,,,,,,M,#,#,#,#,#,#
Until a nodule has achieved 1 cm (10 mm) It is too small to biopsy.,,,,,,,,,,0,0,0,0,0,2
It is likely to yield a false negative.,,,,,,,,,,0,0,0,0,0,2
As you may have noticed the OP mentioned that the surgeon was not able to get an adequate sample when he biopsied the 11mm one.,,,,,,,,,,0,0,0,0,0,2
There was not enough genetic material to test for modifications.,,,,,,,,,,0,0,0,0,0,2
#############################################,,,,,,,,,M,#,#,#,#,#,#
My wife also has stage 4...lung cancer and it is hardest not having any control of the situation everyting is out of my hands...but most importantly it is in the Lords hands.,,,,,,,,,,1-Jan,1,1,2001-10,-1,3
#############################################,,,,,,,,,M,#,#,#,#,#,#
Being here in Florida....and if you are going to be stantioned here maybe you can get your Father to come here....we have two excellent hospitals here.....Florida hospital is in my opinion a life saver....and Moffet...which I know little about but hear it too is an excellent option.,,,,,,,,,,11,1,1,200,2,2
"Stories I have heard since my wife discovered her cancer is.....""people have lifed several years with Cancer""...treatment has come a long way so there is hope.",,,,,,,,,,11,1,1,100,1,3
#############################################,,,,,,,,,M,#,#,#,#,#,#
I hope you are better.,,,,,,,,,,11,1,1,100,1,3
I was just told today this is more than likely in my near future.,,,,,,,,,,0,0,0,0,0,0
I am 50 active and independent and want to stay that way.,,,,,,,,,,0,0,0,0,0,0
Let me know how it's going now.,,,,,,,,,,0,1,1,100,1,0
#############################################,,,,,,,,,F,#,#,#,#,#,#
I have had a lower right lobe lobectomy with the vats procedure for stage 1a NOMO lung cancer.,,,,,,,,,,0,0,0,0,0,2
I was in the hospital 3 days and back to work in a month.,,,,,,,,,,0,0,0,0,0,2
#############################################,,,,,,,,,M,#,#,#,#,#,#
I am so happy to hear that.,,,,,,,,,,11,1,1,200,2,3
I am so nervous.,,,,,,,,,,1-Jan,1,0,00-2000,-2,3
Did you have a lot of pain?,,,,,,,,,,0,0,0,0,0,0
How was your recovery at home?,,,,,,,,,,0,0,0,0,0,0
I really appreciate hearing from you.,,,,,,,,,,11,1,1,200,2,3
#############################################,,,,,,,,,M,#,#,#,#,#,#
Are you having vats?  I had controllable pain for 6 months I only took pain meds the 1st week home.,,,,,,,,,,11,1,1,100,1,2
I would try to walk around the house and eventually for walks in the neighborhood.,,,,,,,,,,0,0,0,0,0,0
I also did breathing exercises.,,,,,,,,,,0,1,1,100,1,2
I was 51 when I had my surgery.,,,,,,,,,,0,0,0,0,0,2
Ask me anything you want as I know its scary to go through.,,,,,,,,,,0,1,1,100,1,3
The best part is finding it so early at the curable stage.,,,,,,,,,,0,0,0,0,0,2
#############################################,,,,,,,,,M,#,#,#,#,#,#
The type of treatment can really vary.,,,,,,,,,,0,0,0,0,0,2
It would also be helpful to know what type of lung cancer and what stage.,,,,,,,,,,0,0,0,0,0,0
#############################################,,,,,,,,,F,#,#,#,#,#,#
I can tell you my husband had squamous stage 3b and had 3 rounds of chemo over about 4 weeks.,,,,,,,,,,0,0,0,0,0,2
He tolerated it very well. He was not working due to another health condition.,,,,,,,,,,11,1,1,100,1,0
But I can tell you although he did not vomit he was tired and it was acculumative and also right after the treatment he was a little...well drunk like.,,,,,,,,,,1-Jan,0,0,0,0,1
So even if he did not have the other condition he would not have been able to work anyway.,,,,,,,,,,0,0,0,0,0,1
He was on cisplatin and etoposide by the way.,,,,,,,,,,0,0,0,0,0,2
#############################################,,,,,,,,,F,#,#,#,#,#,#
I know that is not much of an answer but  am sure others will ad their stories.,,,,,,,,,,0,0,0,0,0,3
Again if you can tell us a bit more it will help.,,,,,,,,,,0,1,1,100,0,3
#############################################,,,,,,,,,F,#,#,#,#,#,#
Oh and remember to drink LOTS of water!,,,,,,,,,,0,1,1,100,1,2
#############################################,,,,,,,,,F,#,#,#,#,#,#
So sorry to know you have to go through the worst.,,,,,,,,,,1-Jan,1,0,0000-20,-2,3
Chemo sucks but it seems to be working for a long time now. ,,,,,,,,,,0,1,1,2001-10,1,2
After chemotherapy my father had so many side effects like headache body pain and vomiting.,,,,,,,,,,0,1,0,0000-20,-2,1
These all are common side-effects after chemo.,,,,,,,,,,0,0,0,0,0,1
He started using hemp oil after his treatment which helped him recover fast and in next few weeks realized that any pain he may have had is no longer there or not as intense.,,,,,,,,,,0,0,0,0,0,2
You can add hemp oil in your daily meal juices or even in salads too when you're out of olive oil.,,,,,,,,,,0,1,1,100,1,2
It tastes quite nutty and crispy and google says it is powerhouse of nutrition when it comes to healthy fats.,,,,,,,,,,0,0,0,0,0,2
We found Charlotte's web hemp oil effective for my father - no side effects.,,,,,,,,,,0,1,1,100,1,2
I suggest you to try some reputed brand who have complete control over their growing and manufacturing process.,,,,,,,,,,0,1,1,100,1,3
I wish you health happiness and all good things in your life.,,,,,,,,,,11,1,1,100,1,3
#############################################,,,,,,,,,M,#,#,#,#,#,#
I am so new at this not sure how my message will work.,,,,,,,,,,0,0,0,0,0,0
I had stage 4 lung cancer - 8 months of chemo plus radiation.,,,,,,,,,,0,0,0,0,0,2
I did work FT and it was like robotic just did what i had to do.,,,,,,,,,,0,1,1,200,2,2
I am blessed with a job that allowed for a flexible schedule so it worked.,,,,,,,,,,0,1,1,200,2,0
When/If my lung cancer comes back (expected) I do not think I could do this again.,,,,,,,,,,1-Jan,1,0,0-200-20,-2,2
It took a lot of my essential energy out forever but thats also OK.,,,,,,,,,,11,1,1,2001-10,1,3
#############################################,,,,,,,,,M,#,#,#,#,#,#
yes I did FT work just cus I need insurance coverage.,,,,,,,,,,0,1,0,2000-10,-1,0
It was not easy but just what needed to do it.,,,,,,,,,,1-Jan,1,0,-1010,-1,2
The hard part was months afterwards with fatigue in my situation and a few other changes in my physiology (bowel/chest radiation).,,,,,,,,,,1-Jan,1,0,2000-10,-1,1
#############################################,,,,,,,,,M,#,#,#,#,#,#
I was 54 when I was diagnosed with this cancer which was in both lungs altho mostly in one lung plus in my lymph nodes in the mid chest.,,,,,,,,,,0,0,0,0,0,1
I did not have a good prognosis but it is now 8 years later and my cancer has not returned as of yet.,,,,,,,,,,1-Jan,1,0,2000-10,-1,0
I did the chemo and radiation together and altho I was fairly ill at the time it was well worth the pain.,,,,,,,,,,11,1,1,200,2,2
Good luck to you and remember that the mind does wonders!,,,,,,,,,,11,1,1,100,1,3
#############################################,,,,,,,,,F,#,#,#,#,#,#
I am sorry your drs are not helping with the emotional shock of the diagnosis.,,,,,,,,,,1-Jan,1,0,2000-10,-1,2
There is no cancer until the biopsies prove there is cancer.,,,,,,,,,,0,0,0,0,0,2
Its irresponsible for the drs to treat you this way and not answer your questions.,,,,,,,,,,1-Jan,1,0,2000-10,-1,3
When I was 1st dx with anal cancer I asked my dr if he would treat his mother with the same protocal as me and he said yes.,,,,,,,,,,0,0,0,0,0,3
My lung cancer was found on follow up scans for the anal cancer and I had my lower right lung lobe removed on 9-23-10 and so far so good.,,,,,,,,,,11,1,1,100,1,2
I really like what pbier posted that gives a lot of hope for people in the same situation.,,,,,,,,,,11,1,1,200,2,3
Just remember pet scans light up everything its sees and inflamation and infection can light up as well.,,,,,,,,,,0,1,0,2000-10,-1,1
I wish you well and keep us posted.,,,,,,,,,,11,1,1,100,1,3
#############################################,,,,,,,,,F,#,#,#,#,#,#
Yes A second opinion is always a good idea.,,,,,,,,,,11,0,0,100,0,0
Please check out the Inspire health web site there are many stage 4 lung cancer patients who post there and have had all the newest treatments.,,,,,,,,,,0,1,1,100,1,3
I wish you and your father well.,,,,,,,,,,11,1,1,100,1,3
#############################################,,,,,,,,,F,#,#,#,#,#,#
Next I went to MD Anderson (#1 Cancer center in the U.S.).,,,,,,,,,,0,0,0,0,0,0
There I met with Dr. Reza Mehran? I tell you this because I think that he?s a fantastic doctor (and I?m very selective).,,,,,,,,,,11,1,1,200,2,2
Dr. Mehran told me that he felt I should not have the surgery that Hopkins prescribed because he felt that I would not survive the procedure.,,,,,,,,,,0,0,0,0,0,2
He asked me to at least postpone my surgery to give MD Anderson an opportunity to give me their honest opinion.,,,,,,,,,,0,0,0,0,0,2
During those tests he found a nodule away from my esophagus making me Stage IV.,,,,,,,,,,0,0,0,0,0,1
The significant of this is that had I had the surgery at Hopkins and survived I would still have esophageal cancer so the surgery would have been for naught.,,,,,,,,,,11,0,0,0,0,2
#############################################,,,,,,,,,F,#,#,#,#,#,#
Dr. Mehran hooked me up with many specialists at MDA.,,,,,,,,,,0,0,0,0,0,2
I?m going to end up getting chemotherapy for my cancer starting next Thursday.,,,,,,,,,,0,0,0,0,0,2
Hopkins is going to administer the chemo but MDA is going to oversee the treatment.,,,,,,,,,,0,0,0,0,0,2
In my opinion Dr. Mehran both saved my life and is giving me a quality of life I would not have had if I had proceeded with the surgery.,,,,,,,,,,11,1,1,200,2,2
#############################################,,,,,,,,,M,#,#,#,#,#,#
What is your doctor saying about the negative PET?,,,,,,,,,,0,0,0,0,0,0
That strikes me as odd?I?m not a doctor but I thought a PET was a good indicator of whether or not something was at least metabolically active (which cancer certainly is).,,,,,,,,,,11,1,0,00000-1,-1,2
#############################################,,,,,,,,,F,#,#,#,#,#,#
The PET was negative except for the tumor of course pleural effusion and nodules.,,,,,,,,,,1-Jan,0,0,0,0,2
Pat I didn't realize that a negative PET scan may respresent cancer that's not metobolically active.,,,,,,,,,,0,1,0,2000-10,-1,2
I'll be sure my parents ask that question.,,,,,,,,,,0,0,0,0,0,0
Maybe this is why it's a little less of a dire situation?,,,,,,,,,,0,1,0,00-20-20,-2,0
#############################################,,,,,,,,,M,#,#,#,#,#,#
Right now the medication he will be taking is Carboplatin and Alimta every three weeks for 9 weeks and then evaluate then.,,,,,,,,,,0,0,0,0,0,2
#############################################,,,,,,,,,M,#,#,#,#,#,#
Also I wanted to ask if anyone here knew of someone who still had surgery even though it was stage IV lung cancer.,,,,,,,,,,0,0,0,0,0,2
#############################################,,,,,,,,,M,#,#,#,#,#,#
I think we will be going for a second opinion just to be sure.,,,,,,,,,,0,0,0,0,0,0
But Pat you also mentioned that it's very important to be comfortable with one's doctor.,,,,,,,,,,11,0,0,0,0,2
My parents seem like they have connected with theirs so we shall see.,,,,,,,,,,0,1,1,100,1,0
The only thing I worry is 9 weeks later it will have spread but I don't want to think about that just yet.,,,,,,,,,,0,1,0,00-1000,-1,1
#############################################,,,,,,,,,M,#,#,#,#,#,#
Any other info would be appreciated and thank you all for your words.,,,,,,,,,,11,1,1,100,1,3
It's been definitely a tough 3 weeks.,,,,,,,,,,1-Jan,1,1,0000-20,-2,0
#############################################,,,,,,,,,F,#,#,#,#,#,#
So you are likely ok there.,,,,,,,,,,11,1,1,100,1,3
My husband has stage 3b squamous.,,,,,,,,,,0,0,0,0,0,0
He was not a candidate for surgery as the tumor was too large and too close to the heart so sorry I can't help you there.,,,,,,,,,,1-Jan,0,0,0,0,2
#############################################,,,,,,,,,F,#,#,#,#,#,#
My understanding is MD Anderson is an excellant facility and can probably get him right away.,,,,,,,,,,11,1,1,100,1,2
I would be sure to check it out.,,,,,,,,,,0,0,0,0,0,0
#############################################,,,,,,,,,F,#,#,#,#,#,#
Thanks for the help Pat! No worries about confusion.,,,,,,,,,,11,1,1,100,1,3
We all want to be sure when we talk about cancer.,,,,,,,,,,0,0,0,0,0,3
#############################################,,,,,,,,,M,#,#,#,#,#,#
But yes the biopsy was actually from the liquid they extracted.,,,,,,,,,,0,0,0,0,0,2
Thats why they had it at stage 4 because it had spread to the effusion.,,,,,,,,,,0,0,0,0,0,1
Not sure if that's a normal diagnosis.,,,,,,,,,,0,1,0,00-1000,-1,2
We'll definitely send it for second opinion.,,,,,,,,,,0,0,0,0,0,0
#############################################,,,,,,,,,M,#,#,#,#,#,#
My wife is having a needle biopsy of a 1.6 cm ggo in a week and is totally scared she has lung cancer.,,,,,,,,,,1-Jan,1,0,00-20-20,-2,2
Yet the nodules are not solid.,,,,,,,,,,0,0,0,0,0,1
They are what are called ground glass opacities  Have any of you have this or does anyone have information about these?,,,,,,,,,,0,0,0,0,0,1
#############################################,,,,,,,,,M,#,#,#,#,#,#
Ground glass nodules usually indicate adenocarcinoma in situ IF it is cancer.,,,,,,,,,,0,0,0,0,0,1
You really can't be certain of anything until the biopsy is back.,,,,,,,,,,0,0,0,0,0,2
If this is adeno in situ it is an extremely slow growing cancer that doesn't spread outside of the lungs.,,,,,,,,,,0,0,0,0,0,1
#############################################,,,,,,,,,M,#,#,#,#,#,#
personally would not wait that long for appointment.,,,,,,,,,,0,1,0,00-1000,-1,3
Do u hane any other abnormal signs going on besides the shortness of breath ?,,,,,,,,,,0,0,0,0,0,1
#############################################,,,,,,,,,F,#,#,#,#,#,#
I would get it removed with NO biopsy...Needle biopsies into the mass...it will leak IF it is cancerous & after results come back you will get rushed to chemo.,,,,,,,,,,0,0,0,0,0,2
They can remove them and treat it LIKE cancer during surgery then do the tests after removal... If Dr says to let it go for a while...DON'T.,,,,,,,,,,0,1,1,100,1,2
Do not play the russian roulette game of What Ifs...For me..any foreign body that grows in me..I like to get it removed BEFORE it becomes something else.,,,,,,,,,,0,1,1,100,1,2
#############################################,,,,,,,,,F,#,#,#,#,#,#
Nodules can appear for a variety of reasons and no they do not always mean cancer however they only way to confirm cancer is to do a biospy.,,,,,,,,,,0,0,0,0,0,2
If you have concerns speak to your doctor about the risks.,,,,,,,,,,1-Jan,1,1,100,1,3
They are the medical professionals.,,,,,,,,,,0,1,1,100,1,3
#############################################,,,,,,,,,F,#,#,#,#,#,#
taking a child into that environment?,,,,,,,,,,0,1,0,00000-1,-1,0
The chemo and radiation can be very exhausting.,,,,,,,,,,1-Jan,1,0,-2020,-2,3
Most of the timle we don't have energy for a shower let alone clean house and mop floors.,,,,,,,,,,1-Jan,1,1,100,1,2
When I was finally strong enough to attempt to empty the dishwasher after treatment it took me an hour to empty it.,,,,,,,,,,11,1,1,100,1,0
#############################################,,,,,,,,,F,#,#,#,#,#,#
This one and the illness are on you. You want to discuss EXTREMELY STUBBORN?,,,,,,,,,,0,1,0,-1010,-1,0
How about the child who is so supremely selfish and ignorant that they can't help their parent clean their home at an extremely low time in their life.,,,,,,,,,,1-Jan,1,0,0000-20,-2,0
#############################################,,,,,,,,,F,#,#,#,#,#,#
I'm not going to be much help but I am goingin for Biopsy #2 on Wednesday.,,,,,,,,,,1-Jan,0,0,0,0,2
Biopsy #1 was 10 months ago.,,,,,,,,,,0,0,0,0,0,2
It was inconclusive.,,,,,,,,,,1-Jan,1,0,2000-10,-1,2
I only have one tumor 9 mm in size now 8 mm in size when first discovered a year ago.,,,,,,,,,,0,0,0,0,0,1
They had me watch and wait for six months then gave me a special PET/CT scan to see if they could detect hormonal emissions.,,,,,,,,,,0,0,0,0,0,2
I probably do have a rare cancer called neuroendocrine carcinoid which 80 percent of the time secretes these hormones but my tumor is not doing so.,,,,,,,,,,1-Jan,1,0,2000-10,-1,1
I'm pretty sure just because it's so small.,,,,,,,,,,11,0,0,0,0,1
So I hope the new biopsy shows something and they will go in and take this whole tumor out and I will be OK. But on the other hand not looking forward to lung surgery so would prefer an absolute negative.,,,,,,,,,,11,0,0,0,0,2
"Anything but ""inconclusive"" though.",,,,,,,,,,0,0,0,0,0,0
That special scan was PET/CT and it was PET/CT scan #2 although the first one May 4 of last year used a different substance injected into me.,,,,,,,,,,0,0,0,0,0,2
That's where they found the lung nodule.,,,,,,,,,,0,0,0,0,0,1
I have high calcium in my blood and they were trying to figure out why.,,,,,,,,,,0,0,0,0,0,1
They still haven't figured out why it apparently isn't the malfunctioning parathyroid glands 99.9 percent of people with hypercalcemia have.,,,,,,,,,,0,0,0,0,0,1
But now they can't figure out what's what with the lung nodule.,,,,,,,,,,0,0,0,0,0,2
And this is UCLA supposed to be one of the best cancer treatment facilities in the United States.,,,,,,,,,,0,1,0,2000-10,-1,2
I'm kind of torn between trying to find if going outside southern California or maybe just to Cedars-Sinai in Los Angeles I would get a better answer and just letting UCLA eventually figure this out.,,,,,,,,,,1-Jan,1,0,2000-10,-1,2
But I guess I start with Wednesday's biopsy and go from there.,,,,,,,,,,0,0,0,0,0,2
I hope your Mom's doctors figure out what's best for her but know that you have a new friend here who doesn't have good answers but understands what your Mom is going through.,,,,,,,,,,11,1,1,100,1,3
#############################################,,,,,,,,,F,#,#,#,#,#,#
I really appreciate your response.,,,,,,,,,,11,1,1,100,1,3
Our pulmonologist said the lungs are hard to biopsy. Harder than the brain.,,,,,,,,,,0,0,0,0,0,2
So I guess our situations are not unusual.,,,,,,,,,,0,1,1,100,1,0
Praying you get definitive benign results!!!!!  Stay in touch!,,,,,,,,,,1-Jan,1,1,100,1,0
#############################################,,,,,,,,,M,#,#,#,#,#,#
A PET scan only records metabolic activity and can only suggest that it is suspicious for a malignancy.,,,,,,,,,,1-Jan,0,0,0,0,2
Only a biopsy can tell if its cancer or not.,,,,,,,,,,0,0,0,0,0,2
After 5 years with no progression the presumption SHOULD be that it is a new primary.,,,,,,,,,,0,0,0,0,0,0
Please consider having the second biopsy done at an National Cancer Institute designated center of excellence.,,,,,,,,,,0,1,1,100,1,3
#############################################,,,,,,,,,M,#,#,#,#,#,#
I had first biopsy at Johns Hopkins.,,,,,,,,,,0,0,0,0,0,2
They said it didn't give them enough information.,,,,,,,,,,0,1,0,2000-10,-1,2
I had to go back for a second biopsy.,,,,,,,,,,0,0,0,0,0,2
As it turned out the first one didn't work because the tumor was so large that they didn't get past all the dead cells.,,,,,,,,,,0,1,0,2000-10,-1,2
The second biopsy gave them all the information they needed to do surgery.,,,,,,,,,,0,1,1,100,1,2
After surgery I did chemo.,,,,,,,,,,0,0,0,0,0,2
That was 3 years ago and no sign of recurrence.,,,,,,,,,,0,1,1,100,1,2
I'm so glad I followed through even though it was very stressful.,,,,,,,,,,11,1,1,100,1,0
#############################################,,,,,,,,,M,#,#,#,#,#,#
I hope this helps. Good luck to your mom!!,,,,,,,,,,11,1,1,100,1,0
#############################################,,,,,,,,,F,#,#,#,#,#,#
My dad was given 6 months to live when he was initially diagnosed with stage 4 non-small cell lung cancer.,,,,,,,,,,0,0,0,0,0,1
It has been 5 years now and he continues to fight the odds.,,,,,,,,,,11,1,1,100,1,1
He has been on Tarceva since his diagnosis no chemo or radiation.,,,,,,,,,,0,0,0,0,0,2
"He tested ""wild type"" for the egfr mutation.",,,,,,,,,,0,0,0,0,0,2
In addition to Tarceva he does a lot of alternative treatments to help boost his immune system and keep a positive attitude.,,,,,,,,,,11,1,1,100,1,2
This post is intended to provide HOPE for those who are battling with lung cancer.,,,,,,,,,,11,1,1,100,1,3
#############################################,,,,,,,,,M,#,#,#,#,#,#
Your father must be the inspiration for others who are surviving from this same situation.,,,,,,,,,,11,1,1,100,1,3
#############################################,,,,,,,,,M,#,#,#,#,#,#
where did your dad get treatment.,,,,,,,,,,0,0,0,0,0,0
I am on tarceva now waitung first results of ct scan to see if any improvement  stage 4 lung cancer.. also had small tumor on brain had gamma radition knife surgery waiting MRI next week for check on this.,,,,,,,,,,0,0,0,0,0,2
I'm fighting for my life alone lost spouse in May 2014 to lung cancer spread to liver bones was to late.,,,,,,,,,,1-Jan,1,0,000-100,-1,1
I have no family just friends and care givers I am in my early 60's.,,,,,,,,,,0,0,0,0,0,0
How did he get through all the side effects. did he take 150mg or 100mgand  how often.,,,,,,,,,,0,0,0,0,0,0
what alternative treament is your dad doing.,,,,,,,,,,0,0,0,0,0,0
#############################################,,,,,,,,,M,#,#,#,#,#,#
I am so sorry for your wife?s loss.,,,,,,,,,,1-Jan,1,0,2000-10,-1,3
Please know that you are not alone we are all here to support you in your battle.,,,,,,,,,,11,1,1,100,1,3
My dad is in southern California receiving treatment from a local medical group.,,,,,,,,,,0,0,0,0,0,2
He has been on Tarceva 150mg for 5 years straight.,,,,,,,,,,0,0,0,0,0,2
His cancer has increased very minimally over the years.,,,,,,,,,,0,0,0,0,0,1
The side effects of Tarceva have been very mild and tolerable (i.e. skin rashes dry eyes dry nose and upset stomach).,,,,,,,,,,11,0,0,0,0,1
He uses special body lotions/creams to help with his rashes and incorporates a lot of holistic treatments including a special diet to boost his immune system.,,,,,,,,,,0,0,0,0,0,2
Most importantly he maintains a positive attitude.,,,,,,,,,,11,1,1,100,1,2
Please feel free to visit my blog to read more about his alternative treatments.,,,,,,,,,,0,1,1,100,1,3
I'll be sending lots of positive energy your way as you await your CT scan and MRI results.,,,,,,,,,,11,1,1,100,1,3
#############################################,,,,,,,,,M,#,#,#,#,#,#
I'm sorry to hear that your mom is going through this.,,,,,,,,,,11,1,0,2000-10,-1,3
There has been a lot of progress made in the field and things are looking up for cancer patients treatment wise.,,,,,,,,,,0,0,0,0,0,2
